{
  "task_id": "GT18_SPECIAL_BUILD_OR_BUY",
  "use_skills": true,
  "selected_departments": [
    "Technology Agent"
  ],
  "skill_sequence": [
    "technology-requirement",
    "technology-feasibility-assessment",
    "technology-specification-confirmation",
    "technology-solution-design",
    "technology-task-breakdown",
    "technology-development-implementation",
    "technology-test-acceptance"
  ],
  "final_status": "completed",
  "blocked_by": [],
  "route_choice": {
    "acceptance_route": "technical_acceptance",
    "build_or_buy": "internal_development"
  },
  "reason": "已明确选择内部开发，因此按技术需求、可行性、规格、方案设计、任务拆解、开发实施到技术测试验收的顺序规划；同一技术需求下外部采购路线与内部开发互斥，故不调用采购、商务或财务 Skills，也不延伸至系统发布。"
}
